{
    "$schema": "https://json-schema.org/draft/2020-12/schema",
    "$id": "https://github.com/antyg/azara/app-registration-config.schema.json",
    "title": "Azure App Registration Config",
    "description": "Schema for Invoke-AppRegistration.ps1. A fresh input config contains the required fields only. The script output is a superset — the same required fields plus generated identity and _meta. The output file is a valid input for subsequent runs.",

    "type": "object",
    "additionalProperties": false,

    "required": [
        "displayName",
        "signInAudience",
        "isFallbackPublicClient",
        "implicitGrantSettings",
        "redirectUris",
        "permissions"
    ],

    "properties": {

        "appId": {
            "type": "string",
            "pattern": "^[0-9a-fA-F]{8}-([0-9a-fA-F]{4}-){3}[0-9a-fA-F]{12}$",
            "description": "Application (client) ID. Present in output. When present in input, the script updates the existing app by exact appId match — no displayName search needed."
        },

        "objectId": {
            "type": "string",
            "pattern": "^[0-9a-fA-F]{8}-([0-9a-fA-F]{4}-){3}[0-9a-fA-F]{12}$",
            "description": "Azure directory object ID. Present in output for reference. Ignored on re-read — the script always resolves objectId from appId via az ad app list."
        },

        "displayName": {
            "type": "string",
            "minLength": 1,
            "description": "App registration display name. Used as the search key when appId is absent (first run bootstrap)."
        },

        "description": {
            "type": "string",
            "description": "Optional app description. Echoed to output but not currently applied to Azure (az ad app create/update does not support --description)."
        },

        "signInAudience": {
            "type": "string",
            "enum": [
                "AzureADMyOrg",
                "AzureADMultipleOrgs",
                "AzureADandPersonalMicrosoftAccount",
                "PersonalMicrosoftAccount"
            ],
            "description": "Who can authenticate. AzureADMyOrg (single tenant) is recommended for most enterprise scenarios."
        },

        "isFallbackPublicClient": {
            "type": "boolean",
            "description": "Enable public client flows (device code, ROPC, WAM broker). True for scripts and CLI tools; false for web apps and confidential clients."
        },

        "implicitGrantSettings": {
            "type": "object",
            "additionalProperties": false,
            "required": [
                "enableIdTokenIssuance",
                "enableAccessTokenIssuance"
            ],
            "properties": {
                "enableIdTokenIssuance": {
                    "type": "boolean",
                    "description": "Issue ID tokens from the authorize endpoint. Typically false for public clients."
                },
                "enableAccessTokenIssuance": {
                    "type": "boolean",
                    "description": "Issue access tokens from the authorize endpoint. Typically false for public clients."
                }
            },
            "description": "Implicit grant and hybrid flow settings."
        },

        "redirectUris": {
            "type": "array",
            "minItems": 1,
            "items": {
                "type": "string"
            },
            "description": "Redirect URIs. In a fresh input config, values may contain {clientId} placeholders (e.g., 'msal{clientId}://auth') which are resolved after app creation. In output (and re-run input), URIs are fully resolved — the replacement is a no-op."
        },

        "permissions": {
            "type": "object",
            "minProperties": 1,
            "additionalProperties": {
                "type": "object",
                "additionalProperties": false,
                "properties": {
                    "delegated": {
                        "type": "array",
                        "items": { "type": "string" },
                        "description": "Delegated scope names (type: Scope). Resolved against the service principal's oauth2PermissionScopes."
                    },
                    "application": {
                        "type": "array",
                        "items": { "type": "string" },
                        "description": "Application role names (type: Role). Resolved against the service principal's appRoles."
                    }
                },
                "anyOf": [
                    { "required": ["delegated"] },
                    { "required": ["application"] }
                ],
                "description": "Permission object with explicit 'delegated' and/or 'application' arrays. At least one must be present."
            },
            "propertyNames": {
                "description": "Resource alias (graph, mde, sharepoint, exchange) or raw App ID GUID.",
                "pattern": "^([a-zA-Z][a-zA-Z0-9]*|[0-9a-fA-F]{8}-([0-9a-fA-F]{4}-){3}[0-9a-fA-F]{12})$"
            },
            "description": "Permissions keyed by resource alias or App ID GUID. Each value is an object with 'delegated' and/or 'application' scope arrays."
        },

        "_meta": {
            "type": "object",
            "additionalProperties": false,
            "description": "Change management metadata. Written by the script on each run. Ignored on re-read — purely informational.",
            "properties": {
                "tenantId": {
                    "type": "string",
                    "pattern": "^[0-9a-fA-F]{8}-([0-9a-fA-F]{4}-){3}[0-9a-fA-F]{12}$",
                    "description": "Azure AD tenant ID where the app was registered."
                },
                "tenantName": {
                    "type": "string",
                    "description": "Azure subscription display name (from az account show)."
                },
                "action": {
                    "type": "string",
                    "enum": ["Create", "Update"],
                    "description": "Whether the last run created a new app or updated an existing one."
                },
                "registeredAt": {
                    "type": "string",
                    "format": "date-time",
                    "description": "ISO 8601 timestamp of the last run."
                },
                "permissionCount": {
                    "type": "integer",
                    "minimum": 0,
                    "description": "Number of permissions (delegated + application) successfully resolved and applied."
                },
                "consentUrl": {
                    "type": "string",
                    "format": "uri",
                    "description": "Admin consent URL for the tenant. Open in a browser to grant consent."
                }
            },
            "required": [
                "tenantId",
                "tenantName",
                "action",
                "registeredAt",
                "permissionCount",
                "consentUrl"
            ]
        }
    }
}
