{
  "displayName": "antyg-IntuneAudit-Delegated",
  "description": "Intune read-only audit — delegated permissions only (interactive user context)",
  "signInAudience": "AzureADMyOrg",
  "isFallbackPublicClient": true,
  "implicitGrantSettings": {
    "enableIdTokenIssuance": false,
    "enableAccessTokenIssuance": false
  },
  "redirectUris": [
    "http://localhost",
    "https://login.microsoftonline.com/common/oauth2/nativeclient",
    "ms-appx-web://Microsoft.AAD.BrokerPlugin/{clientId}",
    "msal{clientId}://auth"
  ],
  "permissions": {
    "graph": {
      "delegated": [
        "AccessReview.Read.All",
        "AuditLog.Read.All",
        "BitlockerKey.ReadBasic.All",
        "CloudPC.Read.All",
        "ConsentRequest.Read.All",
        "Device.Read.All",
        "DeviceLocalCredential.ReadBasic.All",
        "DeviceManagementApps.Read.All",
        "DeviceManagementCloudCA.Read.All",
        "DeviceManagementConfiguration.Read.All",
        "DeviceManagementManagedDevices.Read.All",
        "DeviceManagementRBAC.Read.All",
        "DeviceManagementServiceConfig.Read.All",
        "Directory.Read.All",
        "EntitlementManagement.Read.All",
        "Group.Read.All",
        "IdentityRiskEvent.Read.All",
        "IdentityRiskyUser.Read.All",
        "InformationProtectionPolicy.Read",
        "Policy.Read.All",
        "PrivilegedAccess.Read.AzureADGroup",
        "RoleManagement.Read.Directory",
        "SecurityAlert.Read.All",
        "SecurityIncident.Read.All",
        "ThreatHunting.Read.All",
        "User.Read.All",
        "WindowsUpdates.ReadWrite.All"
      ]
    }
  }
}
