{
  "displayName": "antyg-ProtectionAudit-Delegated",
  "description": "Identity protection (risk events, risky users) — delegated permissions only (interactive user context)",
  "signInAudience": "AzureADMyOrg",
  "isFallbackPublicClient": true,
  "implicitGrantSettings": {
    "enableIdTokenIssuance": false,
    "enableAccessTokenIssuance": false
  },
  "redirectUris": [
    "http://localhost",
    "https://login.microsoftonline.com/common/oauth2/nativeclient",
    "ms-appx-web://Microsoft.AAD.BrokerPlugin/{clientId}",
    "msal{clientId}://auth"
  ],
  "permissions": {
    "graph": {
      "delegated": [
        "IdentityRiskEvent.Read.All",
        "IdentityRiskyUser.Read.All"
      ]
    }
  }
}
