{
  "displayName": "antyg-E8Audit-Delegated",
  "description": "Essential Eight audit and compliance verification — delegated permissions only (interactive user context)",
  "signInAudience": "AzureADMyOrg",
  "isFallbackPublicClient": true,
  "implicitGrantSettings": {
    "enableIdTokenIssuance": false,
    "enableAccessTokenIssuance": false
  },
  "redirectUris": [
    "http://localhost",
    "https://login.microsoftonline.com/common/oauth2/nativeclient",
    "ms-appx-web://Microsoft.AAD.BrokerPlugin/{clientId}",
    "msal{clientId}://auth"
  ],
  "permissions": {
    "graph": {
      "delegated": [
        "AccessReview.Read.All",
        "Application.Read.All",
        "AuditLog.Read.All",
        "ConsentRequest.Read.All",
        "Device.Read.All",
        "DeviceLocalCredential.Read.All",
        "DeviceManagementApps.Read.All",
        "DeviceManagementConfiguration.Read.All",
        "DeviceManagementManagedDevices.Read.All",
        "DeviceManagementRBAC.Read.All",
        "DeviceManagementScripts.Read.All",
        "DeviceManagementServiceConfig.Read.All",
        "Directory.Read.All",
        "EntitlementManagement.Read.All",
        "Group.Read.All",
        "GroupMember.Read.All",
        "IdentityRiskEvent.Read.All",
        "IdentityRiskyUser.Read.All",
        "InformationProtectionPolicy.Read",
        "Organization.Read.All",
        "Policy.Read.All",
        "PrivilegedAccess.Read.AzureADGroup",
        "RecordsManagement.Read.All",
        "RoleEligibilitySchedule.Read.Directory",
        "RoleManagement.Read.Directory",
        "RoleManagementPolicy.Read.Directory",
        "SecurityAlert.Read.All",
        "SecurityEvents.Read.All",
        "SecurityIncident.Read.All",
        "ThreatHunting.Read.All",
        "ThreatIntelligence.Read.All",
        "User.Read.All",
        "UserAuthenticationMethod.Read.All",
        "WindowsUpdates.ReadWrite.All"
      ]
    },
    "mde": {
      "delegated": [
        "Machine.Read",
        "SecurityRecommendation.Read",
        "Software.Read",
        "Vulnerability.Read"
      ]
    }
  }
}
