{
  "displayName": "antyg-GovernanceAudit-Combined",
  "description": "Identity governance (PIM, access reviews, entitlement management, consent) — delegated + application permissions (maximum flexibility)",
  "signInAudience": "AzureADMyOrg",
  "isFallbackPublicClient": true,
  "implicitGrantSettings": {
    "enableIdTokenIssuance": false,
    "enableAccessTokenIssuance": false
  },
  "redirectUris": [
    "http://localhost",
    "https://login.microsoftonline.com/common/oauth2/nativeclient",
    "ms-appx-web://Microsoft.AAD.BrokerPlugin/{clientId}",
    "msal{clientId}://auth"
  ],
  "permissions": {
    "graph": {
      "delegated": [
        "AccessReview.Read.All",
        "ConsentRequest.Read.All",
        "EntitlementManagement.Read.All",
        "PrivilegedAccess.Read.AzureADGroup"
      ],
      "application": [
        "AccessReview.Read.All",
        "ConsentRequest.Read.All",
        "EntitlementManagement.Read.All",
        "PrivilegedAccess.Read.AzureADGroup"
      ]
    }
  }
}
