{
  "displayName": "antyg-E8Audit-App",
  "description": "Essential Eight audit and compliance verification — application permissions only (daemon/service context)",
  "signInAudience": "AzureADMyOrg",
  "isFallbackPublicClient": false,
  "implicitGrantSettings": {
    "enableIdTokenIssuance": false,
    "enableAccessTokenIssuance": false
  },
  "redirectUris": [
    "http://localhost"
  ],
  "permissions": {
    "graph": {
      "application": [
        "AccessReview.Read.All",
        "Application.Read.All",
        "AuditLog.Read.All",
        "ConsentRequest.Read.All",
        "Device.Read.All",
        "DeviceLocalCredential.Read.All",
        "DeviceManagementApps.Read.All",
        "DeviceManagementConfiguration.Read.All",
        "DeviceManagementManagedDevices.Read.All",
        "DeviceManagementRBAC.Read.All",
        "DeviceManagementScripts.Read.All",
        "DeviceManagementServiceConfig.Read.All",
        "Directory.Read.All",
        "EntitlementManagement.Read.All",
        "Group.Read.All",
        "GroupMember.Read.All",
        "IdentityRiskEvent.Read.All",
        "IdentityRiskyUser.Read.All",
        "InformationProtectionPolicy.Read.All",
        "Organization.Read.All",
        "Policy.Read.All",
        "PrivilegedAccess.Read.AzureADGroup",
        "RecordsManagement.Read.All",
        "RoleEligibilitySchedule.Read.Directory",
        "RoleManagement.Read.Directory",
        "RoleManagementPolicy.Read.Directory",
        "SecurityAlert.Read.All",
        "SecurityEvents.Read.All",
        "SecurityIncident.Read.All",
        "ThreatHunting.Read.All",
        "ThreatIntelligence.Read.All",
        "User.Read.All",
        "UserAuthenticationMethod.Read.All",
        "WindowsUpdates.ReadWrite.All"
      ]
    },
    "mde": {
      "application": [
        "Machine.Read.All",
        "SecurityRecommendation.Read.All",
        "Software.Read.All",
        "Vulnerability.Read.All"
      ]
    }
  }
}
